name,speech
Donald Trump,"15) You remember I came and I’d always talk about how bad our trade deals are. We did a brand new one with Korea. So now we have South Korea, we just finished a big one, $40 billion with Japan. On January 15, we’re signing a monster, a big beautiful monster, $40 to $50 billion to our farmers. Our farmers will be taking in, I keep saying go buy larger tractors. Go buy larger tractors. I said there’s no way, I don’t know if you know this story, my people wanted 20 billion to purchase, right? 20 billion, 20, that’s a lot money, that’s a lot of corn, $20 billion, and I said, “Make it 50. China’s very big.” And they said, “Okay.” They said, “Sir, the farmers can’t produce that much.” I said, “Let the farmers tell me that. Tell them to go out and, remember, and buy a bigger what? Tractor, buy a bigger tractor.” You’ll produce it."
Donald Trump,"47) So $40 to $50 billion of agriculture product and the manufacturers and the car companies, and we brought a lot of car companies into Ohio, you know that. A lot of them are coming in. A lot of them have already been brought in. They’re coming in from Japan, they’re coming in from all over the world. This is where they want to be. They want to be in the United States. This is where the action is. They’re all coming back. I used to go around and talk about how everyone’s leaving. They were all leaving. A lot of you were victims of that leaving. These companies would leave, they’d go to Mexico, they’d go to Canada, they’d close up, they’d buy from China. Now they’re all coming back, new ones, old ones, they’re all coming back, and many are coming right here to Ohio. And just in case you didn’t know it, Ohio just had the best year economically in the history of your state. That’s not bad, that’s not bad. And this year’s going to be even better and maybe much better."
Donald Trump,"37) But weeks ago, I signed the largest ever investment in the United States military, $ 738 billion, and we created the sixth branch of the United States Armed Forces, the Space Force, and everybody’s excited about that."
Crowd,"38) USA, USA, USA, USA, USA, USA, USA, USA, USA, USA."
Donald Trump,"09) After years and years of devastating defense cuts, we have fully rebuilt the United States military. Some of it’s still coming in. We have everything. We’ve got new planes, we’ve got new rockets, new missiles, we’ve got new everything, and it’s either here or coming in, $2.5 trillion in new investments. So our military is now stronger and more powerful than ever before. And if you remember, three years ago when I took over, we were depleted. Our military was totally depleted."
Donald Trump,"48) And by the way, speaking of our military, have we taken care of our vets with Choice, with Choice. That was a big thing. You know, I used to go around and the VA was a terrible situation. People would wait weeks. He’s right, he said, “Yes, it was.” You don’t hear too much about that anymore, have you noticed? Choice and accountability, you know what accountability is? For 44 years, they tried to get accountability. That’s somebody bad, works for the VA, you couldn’t fire them. You couldn’t fire them. They could be sadistic, they could be thieves, they could be whatever they were, you couldn’t get rid of them. We got accountability approved, and now we say, “You’re fired, get out.” We get somebody that’s good."
Donald Trump,"09) 44 years, and maybe most importantly of all is Choice, VA, Veterans Choice. So you now wait in line, and a lot of times you’d wait in line for four or five, six weeks you couldn’t see a doctor. Now you don’t have to wait. You go out to a private doctor, you get yourself taken care of, we pay the bill. What a difference it’s made. What a difference it’s made. You know, when I was a little bit newer to this game–"
Crowd,"13) Boo! USA, USA, USA, USA, USA, USA, USA, USA, USA, USA."
Donald Trump,"13) That’s okay, they got it, they got it. They go home to mommy. Go on home to mommy. Go on home to mommy. It’s a beautiful sight. Thank you, security. Do we love law enforcement, by the way?"
Donald Trump,"13) So with the VA, I used to go around saying, “Why don’t they do that? Why don’t these people, why don’t they go to a private doctor and work something out?” And I thought it was a brilliant plan. I said, “I’m telling you I am such a smart guy.” I said, “This is the most brilliant thing ever.” And I went back to my people and I said, “I have an idea. A veteran’s sick, they can’t get the kind of service they need, they need a certain kind of doctor, I have an idea, such a great idea. You get to go out, private, you’re going to pick out a doctor, you’re going to get yourself fixed up. We’re going to pay the bill, right?” And you know what happened? And I said, “How brilliant is that?” They said, “Sir, we’ve been working on that for 48 years, but we’ve never been able to get it approved.”"
Donald Trump,"13) So I was very, very disillusioned, but you know what I’m good at? Getting things approved. And we got it approved. So we signed that 11 months ago, and what a difference that’s made in terms of your lines and in terms of people’s health. People would wait online for weeks, and some people weren’t very sick and they’d end up being terminally ill. They couldn’t get to see the doctor. Now they go out, they get a doctor, we take care of them. We can take care of our vets."
Donald Trump,"19) So we’re using this great power not to pursue conflict, but to really preserve, and I mean in the true sense of the word, preserve peace. We have this tremendous military, and you know what that is? That’s really a great fighting force, but I hope we never have to use it. I really do. You saw an example of that a couple of days ago. So we seek friends, not enemies, but if you dare to threaten our citizens, you do so at your own grave peril. We’ve never had a military, what we have now, we’ve never had anything like it. We were looking at planes that were old and tired, 50, 60-year-old planes. You’ve heard the story, the grandfather flew them, the son flew them, the current wonderful person flew them, the whole family flew them. Those are all gone now, folks. Those are all gone."
Donald Trump,"52) In October of last year, US Special Operations Forces executed a daring nighttime raid that killed the bloodthirsty founder and leader of ISIS. The animal known as al- Baghdadi is dead. And the entire ISIS caliphate is destroyed, and his terrorist empire, and he was indeed a monster, has been totally demolished. We killed thousands and thousands of ISIS warriors, fighters, and we have thousands of them right now locked up where they should be. Nobody has ever done what we’ve done in three years. And I’ll say this, when we took it over, it was a mess. We did it in a short period of time, but when we took it over, it was not good. And last week, the United States once again took the bold and decisive action to save American lives and deliver American justice. And you know what I’m talking about."
Donald Trump,"21) For years, the sadistic mass murderer, Qasam Soleimani, planned and executed attacks against American targets, killing and wounding thousands of US service members and many, many thousands, and even hundreds of thousands, of other people. As the leader of Iran’s terrorist Quds Force, Soleimani spread death, destruction, and mayhem across the Middle East and far beyond. He ordered the violent assault on the American embassy in Baghdad. And you saw this was the anti-Benghazi. We got there very quickly. We got there very quickly. This is the exact opposite, we did it exactly the opposite of Benghazi, where they got there so late, all they saw when they got there days later were burning embers from the days before. That’s all they saw."
Donald Trump,"12) We got there very early. We saw what was happening. I saw what was happening, and I said, “What’s that all about?” And that was going to be another Benghazi. Had they broken through the final panels of glass, they were breaking and breaking it, had they gotten through, we would have had either hundreds of dead people or hundreds of hostages. That wasn’t going to happen. And I called up our great generals, and I said, “Get them over there now.” And one of our leaders, one of our really admired people, said, “Sir, we’ll have them there tomorrow.” I said, “Nope, get in the planes right now, have them there immediately,” and they got there immediately, fortunately."
Donald Trump,"27) But he directed the recent rocket strikes that wounded four American service members, badly wounded, and killed an American citizen. That was just before we happened to hit him. Soleimani was actively planning new attacks and he was looking very seriously at our embassies, and not just the embassy in Baghdad. But we stopped him, we stopped him quickly and we stopped him cold. So at my direction, the United States military eliminated Qasam Soleimani and ended his rampage through not only that part of the world, but much bigger parts of the world, he was all over. He was a bad guy, he was a bloodthirsty terror and he’s no longer a terror, he’s dead."
Donald Trump,"43) And yet now I see the radical left Democrats have expressed outrage over the termination of this horrible terrorist. And you know, instead they should be outraged by Soleimani’s savage crimes and the fact that his countless victims were denied justice for so long. He was the king of the roadside bomb. You know of the roadside bomb, and then they got bigger, and he’d send them over to Afghanistan and Iraq. And when you see our friends and our great wounded warriors and our great warriors, when you see them without their legs and without arms and with so much damage, it’s most likely that he caused that damage, because that’s what he liked. He loved planting the roadside bomb. So now he’s gone, and that’s a good thing."
Donald Trump,"10) Bernie Sanders, crazy Bernie, has condemned the US military strike on Soleimani, the world’s top terrorist, think of it, the world’s top terrorist, and we’re having people like Nancy Pelosi, that’s a real genius, do you believe that one? Nancy, nervous Nancy. But here’s a guy who slaughtered and butchered civilians all over and military, whoever was in his way, and we have Bernie and Nancy Pelosi, we have them all, they’re all trying to say, “How dare you take him out that way? You should get permission from Congress. You should come in and tell us what you want to do. You should come in and tell us so that we can call up the fake news that’s back there and we can leak it.” That’s a lot of corruption back there, folks."
Donald Trump,"05) No, but think, seriously, so they want me… So these are split-second decisions. You have to make a decision. So they don’t want me to make that decision. They want me to call up, maybe go over there, let me go over to Congress, or come on over to the White House, let’s talk about it. When can you make it? Well, I won’t be able to make it today, sir, so how about say in a couple of days? Oh, good, come on over. No, we got a call, we heard where he was, we knew the way he was getting there, and we had to make a decision. We didn’t have time to call up Nancy, who is not operating with a full deck. No, they want us to call, can you imagine calling crooked Adam Schiff? He’s so crooked, he’s so crooked. Shifty Schiff and say, “Gee, Adam, how are you doing? Listen, we have the world’s number one terrorist, killed thousands and thousands of people. We’d like to set up a meeting so we can discuss his execution. Would you be willing to meet?” “Well, I won’t be able to make it this week.” “Well, you know, he’s traveling fast. We got him lined up, Adam, you little pencil-neck.” Nine inches. He buys the smallest shirt collar you can get, and it’s loose. Now come on, Adam, we got to meet faster on it. We got to take this guy out. We’re not going to have another shot at him maybe ever again. “But I can’t make it now because I’m trying to impeach Trump, I’m trying to impeach, even though he did nothing wrong.”"
Donald Trump,"25) By the way, did you see, I did nothing wrong. They don’t even know what in the hell is going on. In fact, it’s so weak, she doesn’t want to put in the articles, it’s so weak. They’re so pathetic. They’re so pathetic. So they want us to call them. Now, Schiff is a big leaker. He leaks to crazy CNN. See with the little red light on over there."
Crowd,27) Boo.
Donald Trump,"27) Not too many people are watching CNN. But he leaks. So he’ll say, “You know, off the record, I got to hurry up because everyone’s watching me in the hallway on my cell phone, off the record they’ve got the number one terrorist in the world, Soleimani, and they’re going to get him, they’re going to take him out in the next 10 minutes. Please, don’t tell anybody I told you.” So we have breaking news, President Trump within the next 20, 25 minutes, looks to be taking out terrorist General Soleimani. He’s going to do it. It should be happening in about the next 20 minutes, 19, 18, 17.” Then we get back to the battlefield, how’d you do, fellas? “I don’t know, sir, he disappeared. I don’t know what happened to him.” They want us to tell them so that they can leak it to their friends in the corrupt media."
Donald Trump,"27) You got to say though, that’s a lot of media, right? That’s the way the Academy Awards used to look when it was successful. Then they started hitting us all the time and it became unsuccessful. I love it, I love it, actually. Oh, they have some bad ones here tonight. They have some really bad ones, some really sick ones. They have one good one, by the way, one good one. They have one good one, a bunch of bad ones. Very, very dishonest people and we have some great ones, too."
Donald Trump,"27) We have some great journalists, great reporters. But you’ve got a tremendous amount of dishonest media people like I have never seen in my life before. They write things that they know are wrong. They write, if you watched for the last three years, think of it, and then they get Pulitzer Prizes, but it turned out to be all wrong. How do you do that? They get Pulitzer Prizes for being wrong. The Pulitzer Prize doesn’t mean a thing. It doesn’t mean a thing."
Donald Trump,"27) I mean, I’m here to tell you about the Nobel Peace Prize. I’ll tell you about that. I made a deal. I saved a country. And I just heard that the head of that country is now getting the Noble Peace Prize for saving the country. I said, “Did I have something to do with it?” Yeah, but you know, that’s the way it is. As long as we know, that’s all that matters. I saved a big war. I saved a couple of them. But under my administration, we will never make excuses for America’s enemies, we will never hesitate in defending American lives, and we will never stop working to defeat radical Islamic terrorism, never. And nobody’s done it like we’ve done it. And it’s we, it’s we. It’s not me, it’s we. It’s a whole movement."
Donald Trump,"27) There has, by the way, never been a movement like this. You know, outside, I don’t know what this place holds, it’s like 10, 11,000 people, right? Outside you have thousands and thousands of people that want to get in. There’s never been a movement like this. There’s never been a movement like this. And I’ll tell you, maybe I’m wrong, but this is bigger than it was in 2016, because in 2016 I said what we’re going to do, but now I’ve completed more promises than I’ve made. I mean, I’ve actually completed more, right?"
Crowd,"27) Four more years, four more years, four more years, four more years, four more years, four more years, four more years."
Donald Trump,"27) Like, as an example, many of you were here, look at all those beautiful red hats, keep America great, that’s good. But I never talked about, did you ever hear me prior to the election talk about Space Force? I never talked about it. We did Space Force, but did we ever speak about it? No. There were many things that we’ve done that we never spoke about, right? Right to Try, you know about Right to Try, right? They’ve been trying to get it for 44 years, Right to Try. That’s people that are very sick, terminally ill, and they can’t get medicine that possibly works. And very well, we have the greatest labs and the greatest doctors in the world, the greatest scientists in the world, we have the greatest medicines in the world."
Donald Trump,"27) If they have something that they’re pretty sure is going to work but is going to take another six years, I brought those times way back, by the way, way down, but they would travel to Asia, they would travel to Europe, they would travel all over the world to try and get a cure because we wouldn’t sell them the medicine because we didn’t want to take a chance on making the people sick. I said, “Wait a minute, they’re going to die. They’re going to die.” “Well, sir, we can’t take the liability.” I said, “Then we’ll draw up a statement assessing all liability, taking all liability away from the country, away from the insurance companies, away from the healthcare companies, away from the doctors.”"
Donald Trump,"27) And with the great help of a lot of incredible Republicans, and we had some Democrats help us, we passed Right to Try, and you have to see how this works. Some people are being, many people are being saved. And you know, the drug companies didn’t like it because they didn’t want to take people that sick, because they didn’t want it on their charts. I said, “I understand that. We won’t include that. We’ll have a separate list over here.” They said, “Oh, would you do that?” I said, “Yeah, I’ll do that, I’ll do that.”"
Donald Trump,"29) But I didn’t talk about Right to Try. I never said I was going to get that done, we got it done. That was a tough one to get done. It sounds simple, but it was tough. There’s nothing easy in this country. You know, they said to me, a friend of mine the other day, “Who’s the toughest country to deal with, President?” He used to call me Donald. I’ve known this guy for a long time. I’d like to say 20 years, but it’s much more than that. I just don’t want to tell you how long, it’s too long. And I said, “Call me Donald. You’ve always called me Donald.” “I can’t.” He calls me Mr. President. I’ve known this guy forever. He used to call me, “Hey, Donald, let’s go out to dinner.” You know before, he’d go, “Hey, let’s go out to dinner.” Now he goes, “Mr. President, sir, how are you?” Right? How are you? But what we’ve done, and he said, he told me, “What you’ve done, we’ve never seen anything like it.”"
Donald Trump,"37) So many people are saying that. We are all together doing something, not only in terms of the election, not only in terms of what we’re doing right now. Don’t forget, it’s a long way to the election. You know, we have what, 10 months? That’s a long way. This is my first stop of the year, first major stop of the year. This is it. And we start."
Donald Trump,"42) By the way, let’s do one of those polls right now, do you mind? Is there anything more fun than a Trump rally? Here we are."
Donald Trump,"00) Anything more fun than a Trump rally? Here we are. We have the greatest phrase of all time, Make America Great Again, and all due respect, I’ll never end … I’m a little superstitious. I’ll never end it, Make America Great Again, but I see all those hats. I see all those hats, changing it a little bit, but Make America Great Again."
Donald Trump,"17) I said, you know, today, we just hit the highest stock price in the history of our country. Your 401ks are at records, your stocks are great, but what it really means to me is jobs, more importantly, than anything else. We have the best jobs, the best everything, right? We just hit … I can’t really say, Make America Great Again."
Donald Trump,"45) Our military is rebuilt, $2.5 trillion. Our military is rebuilt. We’re doing great numbers. Economically, our country is the strongest it’s ever been. You have factories moving back into Ohio. You never saw anything like it, right? You had your best year. When I say Make America Great Again, what that sort of means is we didn’t get there, but we did get there."
Donald Trump,"46) Now, I have a new theme. It’s called Keep America Great. Keep America Great. Now, I’m a very loyal person, and I am concerned about changing the theme because Make America Great Again I think was the greatest political campaign in history. I mean, crooked Hillary spent three or four times more money than I have spent."
Donald Trump,"59) Crooked Hillary, wait, crooked … We should lock her up, I’ll tell you. Crooked Hillary spent three or four times more. I wanted to be a little bit … I have to say, that was a great campaign, and I don’t want to change it. I don’t want to have this incredible 2016, then go with something, and if something ever happened, this country will go to hell, I just …"
Donald Trump,"12) You know the stocks I’m talking about, the records. You don’t have records this way. You have records. Get used to it, because if that happened, you will see things happen that aren’t good. But, I have to now say, do I want to change the greatest theme in political history, Make America Great Again, with Keep America Great, right?"
Donald Trump,"23) Let’s take a little applause, right? We’ll go Make America Great Again, you’d clap if you want that. Then we would go, Keep America Great, you’d clap if you like that. Okay, are you ready? First, Make America Great Again. Ready? Keep America Great."
Audience,"23) USA, USA, USA, USA, USA, USA, USA, USA, USA."
Donald Trump,"23) You know, that, I call that a free poll. That’s better than a poll. Do you ever see these crazy polls that come out? We’re doing great in the polls, by the way. Remember, I used to come out and talk about the polls? We’ll start doing that very soon. We’re doing great in the polls, but this is like a free poll."
Donald Trump,"23) Somebody else would go out, they have all this money that they raised, and they give somebody $1 million, and they’ll ask 200 people that question. Then, they’ll say, “Well, Make America Great Again is better,” but I will tell you, I haven’t heard one thing where that was true. With all of these … I would have said, instinctively, Make America Great Again could not be beaten. I’ve probably done this 10 times. I have never had it win. It’s Keep America Great, and that’s what we’re doing, but we’re going to use both. We’re going to use both."
Donald Trump,"24) We’re going to use both, because there’s no way that I’m going to jettison Make America Great, right? There’s no way. We’re going to use both, but this hat is a hot seller. We’re selling that hat like nobody’s ever sold a hat before,  … Good. Keep America Great. We’re going to use both, but Keep America Great. That’s probably going to be the dominant theme."
Donald Trump,"43) For eight years, the Obama administration enabled and emboldened-"
Audience,43) Boo.
Donald Trump,"06) … the Iranian regime. They gave Iran $150 billion, including $1.7 billion-"
Audience,26) Boo.
Donald Trump,"30) … in hard, cold cash. Can you imagine? No, no, can you imagine? $1.7 billion, $1.8 billion in cash?"
Audience,37) Boo.
Donald Trump,"37) The foolish Iran nuclear deal financed Iranian aggression while allowing a quick path to nuclear breakout, that’s what it did. By the way, it expires so soon. They can have nuclear weapons. They’re not, as I said before, they will not have nuclear weapons."
Donald Trump,"46) By subsidizing Iran’s malign conduct, the last administration was leading the world down the path of war. We are restoring our world to the path of peace, peace through strength, peace through strength. Our country’s doing great, and I think something is going to happen that’s got to be good. You know, we’ve sanctioned the hell out of Iran, and we just put more on  …"
Donald Trump,"49) They hit us with 16 missiles, and I said, “How many?” We were ready to go. We were ready to go. I said, “How many? How many died? How many were wounded?” “Sir, none.” None? Pretty good warning system, none. How many were hurt? How many were … None, sir. So, we didn’t do anything. We were ready. We were ready. Not that I wanted to, but we were ready. You have no idea. A lot of people got very lucky."
Donald Trump,"12) We’re thrilled to be joined tonight by many great Republican leaders, a man who has helped me right from the beginning, a very special guy, Representative Bill Johnson, Bill. Where is Bill? Thank you, Bill. Thank you, Bill. Great job, great job, and his fellow friends, Jim Jordan,  …"
Donald Trump,"12) We have a lot of your Congressmen right now in Congress. They said, “Sir, should we come with you?” I said, “No, stay back and vote.” They’re voting on some pretty important stuff, right? But, we were able to get Bill. We thank you, Bill, very much, great job, great warrior. Thank you, Bill."
Donald Trump,"12) Ohio Lieutenant Governor, Jon Husted. Thank you, Jon. Thank you, Jon. Thank you, Jon. Great job. State Treasurer, Robert Sprague. Thank you, Robert, and you have a lot more money in the bank right now, Robert, as Treasurer, right, than you ever did?"
