name,speech
Donald Trump,"So in 2016 we had in my opinion the greatest phrase in the history of politics, make America great again. Now we are within moments hopefully of having, despite what you heard a few weeks ago, where we were heading. And they’re going, “Please, please let there be a recession, please.” They’re willing to give up their results because they think it will help them win the election. They’re not going to win the election."
Donald Trump,"Don’t forget, we are doing this and still fighting the unfairness of China and other countries on trade. What happens when that gets fixed and other things get fixed? We’re setting new records and we’re fighting trade deals and we’re fighting military deals that are unfair to our country. Think what happens when it all gets fixed, We have ourselves a country that’s going to be so strong. But we had a phrase, make what? Make America great again, the best."
Donald Trump,"I think it was maybe the greatest, 2016, but we’ve done a lot and now they’re very close to setting a new … I think it’s the 118th time that we will have set a new record with the stock market, right? Many, many times, many, many times. I can’t be certain that many but it’s a lot, okay? I always have to preface it because there’ll be headlines, Trump didn’t tell the truth. So I’ve always got to be extremely cautious."
Donald Trump,"We had the greatest phrase of all time and even the fake news media would agree, make America great again, MAGA country, make America great again. Now we still have a year and a half, little bit less, can you believe it? Can you believe it? I stood in the White House with the first lady that first night and I said, “Wow, look at this. That’s the bedroom of Abraham Lincoln,” you have to see this. It’s so perfectly done, it’s so the way it was."
Donald Trump,"That’s the bedroom of the great Abe Lincoln. “Honey, can you believe this?” That was the first night and now in less than a year and a half, the first term will be over. Think of that. I announced today that we got the soccer World Cup, that’s a big thing, who else was going to do it? But we’ve got a problem, it’s in 2026 . We announced it in front of the press and in 2026."
Donald Trump,"And I said, “Well, wait a minute, under the normal rules I will be out in 2024 so we may have to go for an extra term.” Oh, they’re going crazy. Tomorrow, you will see headlines, Trump wants an extra term, I told you, I told you. He wants an extra term, ladies and gentlemen. We told you, we told you he’s a dictator, we told you. No, no, I’m only kidding, I’m only kidding."
Donald Trump,"But we actually have the World Cup, it’s the biggest sporting event in the world and we got it. And that’s where we’re working it also with Mexico and Canada to give them some of the games. We’ve got a great relationship with the World Cup, it’s a big deal. Bob Kraft helped me with the New England Patriots people. Tom Brady had a pretty good game the other night, right? They have a good a coach, whether you like it or not, and I know you, North Carolina."
Donald Trump,"But how good a coach, in all fairness here, is Coach Belichick? How good is he? I know you want to be cool but he’s pretty good. We have to appreciate genius, we all like genius. But we are going to achieve new breakthroughs in science, medicine, finding new cures for childhood cancer and ending within 10 years the AIDS epidemic in America. That’s shocking to hear that but we can do it, we’re going to do it, definitely."
Donald Trump,"Incredible, the strides that we have made. We will defeat the Democrats to drive up the cost of houses, cars, healthcare and education by liberating Americans from their analysts’ push for a job killing, soul crushing Washington regulations. As an example, we’re trying to get the car companies, going to give them a little bit of extra energy and they will be able to build a car that consumers can buy which will be better than the car they make today."
Donald Trump,"And you’ll save 3,500 dollars, think of that. It will be safer, it will be better, you can save 3,500 dollars, it will be less costly. And we’re going to try to get that done. And then they were forcing you to buy light bulbs that cost a fortune, so I signed something a couple days ago that gives you the right to continue to use the incandescent light bulbs, I don’t know about you, much less expensive."
Donald Trump,"I don’t know about you but … I don’t know, I’m not a vain person. And I know I have real vain people, especially these incredibly ladies in the front, but I look better under an incandescent light than these  lights that are beaming down over us. But you know, somebody told me that as you know, they’re much more expensive bulbs than for what you save."
Donald Trump,"But they said that if the bulb break, it’s considered almost like the waste site. It’s very big, the bulbs, the new bulbs, they’re very dangerous with all of the gases. And I said, “What’s the point?” Well, then he said, “Well, I’m saying if we continue that production, they can buy whatever they want to buy but it can really save a tremendous amount of money and even have a light that’s better.”"
Donald Trump,"And there is a big danger, in fact they have labels, don’t break this bulb. What do you do, you’re going to throw it away? I promise I won’t break it, all the new ones. So you can hopefully buy the new ones but you can buy the old ones too and you can save a lot of money and you could even look better. We will defend privacy, free speech, free assembly, religious liberty and the right to keep and bear arms."
Donald Trump,"Above all, we will never stop fighting for the values that bind us together as one America, we’ll be one united nation. We’ll support, protect and defend the Constitution of the United States. We stand with the incredible heroes of law enforcement, thank you, law enforcement. We believe in the dignity of work and the sanctity of life. We believe that faith and family, not government and bureaucracy, are the true American way like you."
Donald Trump,"We believe that children should be taught to love our country, honor our history, and to always respect our great American flag. And we will live by the words of our national motto, in God we trust, it’ll stay there. We stand on the shoulders of American patriots who crossed the ocean, settled the continent, tamed the wilderness, revolutionized industry, pioneered science, won two world wars wars, defeated fascism and communism, put a man on the moon and built the most exceptional country in the history of the world."
Donald Trump,"We are great Americans and the future belongs to us. The future belongs to you. With your help, your devotion and your drive, we are going to keep on working, we are going to keep on fighting and I’d like to fight a little less with these people but they just don’t stop. They just keep coming at you in waves. They are unfortunately not the best people. And we are going to keep on winning, winning, winning, we’re going to keep on winning."
Donald Trump,"We are one movement, one people, one family and one glorious nation under God. America is thriving like never before, we may have right now the greatest economy in the history of our nation. And ladies and gentlemen of North Carolina, the best is yet to come. Together we will make America wealthy again. We will make America strong again, we will. We will make America safe again. And we will make America great again. Thank you, everybody. Thank you, North Carolina. Thank you."
Donald Trump,Thank you.
Crowd,USA. USA. USA. USA. USA. USA. USA. USA. USA. USA. USA.
Donald Trump,"Wow, thank you. Thank you, New Mexico. Thank you. We love being with you. We love being with you. Incredible people, incredible people. Thank you very much. And I’m thrilled to be here in Albuquerque with thousands of hard-working, freedom-loving American patriots. Thank you. Incredible."
Donald Trump,"We’re all united by the same love of our great country. And by the way, our country is doing great. You see it. The same devotion to family and the same profound faith that America is blessed by, the eternal grace of Almighty God."
Crowd,.
Crowd,USA. USA. USA. USA. USA. USA. USA. .
Donald Trump,"Good night to that person. Tomorrow they’ll say, “Massive protest.” No, one person just going home to mommy a little bit sooner. Good night. But we’re bound by these convictions. We will campaign for every vote, and we will win the great state of New Mexico in 2020. And by the way, you have thousands and thousands of people outside who can’t get in. So we love you, we love you, we appreciate it. We try to get the biggest arena we can get, and they’re never big enough, frankly. So there’s something going on. And I always say, 2016, I don’t know if there’ll ever be another 2016."
Speaker 1,"We love you, Trump."
Donald Trump,"But right now it’s like a great tree or a great plant, you plant it and it has to take hold. We have to win 2020. We’re doing so well. We have to win 2020. And every day, and you know as well as I do, we’re battling against the corrupt establishment of the past, and we’re achieving historic victories for the American people. We’re winning again. We’re winning again, and we’re winning big. We’re winning big."
Donald Trump,"Crucially for your state, we have ended the last administration’s war on American energy. And since my election, natural gas productions, big story today, in New Mexico has increased by 40%, 4-0. And that means great wages, and it means jobs. And that’s why you’re breaking every single record in your state’s book. Crude oil production in New Mexico has more than doubled, and going up a lot higher very quickly. And your state’s energy revenues are up by nearly two-thirds. Think of that. Two-thirds. And that’s in a short period of time. Give me a little bit more time, okay?"
Crowd,.
Donald Trump,"The United States is now the number one producer of oil and natural gas anywhere in the world. And this means more jobs, higher wages, and American energy independence, which is what we have."
Donald Trump,"A few years ago, if we had a problem like you saw two days ago in the Middle East, we would’ve been in a panic. Although, not if I were your president. We never panic. We don’t want to panic. But a few years ago, they would have been in a panic. Today we got a lot of oil, we got a lot of gas. We got a lot of oil and gas."
Donald Trump,"We don’t have to send too many boats over there. Did you notice the other day, they were saying, “We don’t see too many American ships anymore.” You know why? Because we don’t need … We’re independent, as independent as we want. And we are now a net exporter of energy. Revenues from energy production provide up to 25% of your state’s budget and going much higher in the very near future. And they’ve generated nearly a billion-dollar budget surplus in New Mexico. Thank you very much, president Trump. Thank you."
Donald Trump,"Now, under the Green New Deal, that all goes away. That all goes away. It all goes away. You can forget it. No more cows, no more airplanes, no more trips. A single car. Make it electric. Single car. You’re not allowed to travel more than 162 miles. They’ll call us “the hermit nation.” We’ll never leave our house. No, it’s crazy. But that’s okay. I don’t want to bring it up because I don’t want to do it too early. Maybe they’ll change, and I don’t want them to change."
Donald Trump,"But think of it for you, and for Texas, and for so many other places, they want to get rid of your energy. I mean, explain that one."
Crowd,.
Donald Trump,"Explain that. Yet, every major Democrat running for president, they want to abolish all production of oil and natural gas. In other words, the Democrats want to completely annihilate New Mexico’s economy. The Democrats want us to be subservient to foreign producers. They want us to be at the mercy of rogue regimes. That’s not happening anymore. It’s been a long time. It’s been a long time. It’s not happening anymore. But Democrats will never get the chance because New Mexico will never give them that chance."
Crowd,". USA, USA, USA, USA, USA, USA, USA, USA, USA, USA, USA, USA, USA, USA."
Donald Trump,"Under this administration, America is working again. America is winning again. And America is respected again, like it hasn’t been for a long time. And I can tell you because I meet so many of the leaders, and their presidents, and their kings, and their queens, and their prime ministers, and their everything, dictators every once in a while. Every once in a while, you get an a rogue dictator. And I’ll tell you, they always start off, today I had the Crown Prince of Bahrain, and they come in and they say, “Sir, I’d like to congratulate you on what you’ve done with the economy of the United States. It’s a model for the entire world.” They all say it."
Donald Trump,"And earlier today … Do we have any baseball fans? Right? Right? You know what I’m going to say. But earlier today in the White House, I had the honor of awarding the Presidential Medal of Freedom, that’s the highest civilian award, to someone who truly embodies the American dream, baseball legend, the greatest, by the way, the greatest relief pitcher of all time, you look at those records, Mariano Rivera. He was something. The Yankees won a lot of World Series because of Mariano. Great guy. We gave him the medal. Done so much for charity. A fantastic man, fantastic family. It was a beautiful day at the White House, so it was good."
Donald Trump,"My administration is fighting to empower all Americans to reach their dreams and achieve their potential. We have created six million new jobs since election day. The fake news would never have allowed us to say that during the campaign, even as a projection. Unemployment recently reached its lowest rate in over 50 years. More than seven million Americans have been lifted off of food stamps. Nearly 600,000 Americans came into the labor force last month alone. Think of that."
Donald Trump,"Wages in your state, New Mexico, are growing at a rate of much more than 3% a year, which is unheard of 20 years ago. And I used to say during the campaign, you go back, it’s hard to believe, I’m here almost three years … Can you believe how time is flying? Can you believe it? I don’t know about it me, but you look all much better than you did three years ago. You’re wealthier. And even with the Me Too movement, we can’t say this, but I’ll say it anyway, you’re better looking, including the men, including the men. Now you’re all looking good."
Donald Trump,"Since my election, the number of new business applications for New Mexico has increased by almost 30%, more than any state in the United States. Think of that. More than any state in the United States."
Speaker 2,We love you.
Donald Trump,"So essentially, that’s saying you’re in a certain category, which is a very important category, you’re doing better than any state in the United States. How do I lose New Mexico? Explain that one, right? How do we lose that one? And yet, for whatever reason, it’s been quite a while since a Republican won this state. But we’re going to win this state. And I think we’re going to win this state easy. You had to see the people all the way in from the airport. That was a long drive by the way, 35 minutes. That was a long drive. But all the way in, we had people, and they were waving. And I didn’t see any negative hand gesture, right? No, I think we’re going to do great here. And we’re here for a number of reasons, but we’re here because we really think we’re going to turn this state and make it a Republican state. Yesterday marked the beginning of the Hispanic Heritage Month. Who is Hispanic here? Latinos for Trump. Thank you. Incredible people. But we have much to celebrate. Unbelievable when you think, the unemployment for Hispanic-Americans is right now at the lowest level ever recorded in the history of our country. Hispanic-American poverty reached a brand new all-time low in history. And after years of stagnation that you know very well, wages for Hispanic-Americans are rising really fast, up nearly 8% since my election. Those are unheard of numbers. They’re unheard of. And median income, think of that, median income for Hispanic-Americans surpassed $50,000 for the first time ever. That’s your median. That’s not bad. That means you’re wealthy and you’re getting wealthier fast. And I just want to tell you it’s an honor."
Donald Trump,"But when I’m on the debate stage debating one of these far left radical Democrats, whoever it may be, and they start telling you what they’re going to do for you, and you say, “But we have the best numbers, every category, that we’ve ever had.” Hispanic-Americans … excuse me, New Mexico as a whole, we have the best numbers. African-Americans, the best numbers that we’ve ever had in the history of our country. Asian-Americans, the best numbers that we’ve ever had in history. Women, the best numbers that we’ve had in 71 years. We’re working night and day to deliver a future of limitless opportunity for our nation’s Hispanic-American citizens, including millions and millions of extraordinary Mexican-Americans who enrich our society, strengthen our country, serve in our military, and contribute immensely to our shared American family. And I want to just tell you that Mexico is doing a great job for us on the border, and I want to thank the president of Mexico."
Crowd,. Build the wall. Build the wall. Build the wall. Build the wall. Build the wall. Build the wall. Build the wall. Build the wall. Build the wall. Build the wall. Build the wall. Build the wall.
Donald Trump,"You know, it’s very interesting, I hear everybody screaming, well, you know we’re building the wall, and it’s going up, and it’s going up fast. And if you think that’s easy with the Democrats who control the House, we have to take it back, but if you think it’s easy … But we’re building a lot of wall. We’ll have almost 500 miles of wall built by the end the next year, and it’s making a big difference. 500 miles. But you know we won a big case two months ago in the Supreme Court that allowed us to do what we’re doing. This has been … I’ll tell you what. Ready? Another president would have given up a long time ago. We don’t give up. So we’re building the wall, the Army Corps of Engineers, we’re doing a beautiful job. It’s a great, it’s a great structure. It’s a great structure. You’re going to have to really want to get over that wall, to do it."
Donald Trump,"But it was very interesting because, not too long ago, I saw where the Hispanic-American, the Hispanics, were up with me in a poll, 17%. And everyone said, “How is that? How is that? How is that? 17%. Up by 17%. I won’t even tell you what the final number was because they won’t believe it, but you’re going to see what the final number … But you know why? Because the Hispanic-Americans, they understand, they don’t want criminals coming across the border. They don’t want people taking their jobs. They want to have that security, and they want the wall. They want the wall."
Crowd,.
Donald Trump,"And we have a man in the audience who is, I think, the best dressed man in this entire place, including me, right here. Look at him. Come here. Look at him. Look at this guy. And he’s been to a couple of rallies too, haven’t you? Huh? We have some people, a group of people the other day, you know, we had a victory in North Carolina that was unbelievable. Two of them. One of them, it was going to be very, very close."
Donald Trump,"Here’s another one of my friends. Thank you. I like that beautiful red tie you’re wearing. But we had a victory, two victories, North Carolina, where one was 17 points down three weeks ago, we got involved, we started sending out lots of different social media messages, we did a couple of little robo calls, but the big thing, we did a speech the night before. The turnout was beyond belief. And instead of being down by 17 points, he easily won the election 4,000 or 5,000 votes."
Donald Trump,"Dan, thank you, Dan. Thank you, Dan Bishop."
Speaker 3,"Thank you, Trump."
Donald Trump,"And Greg Murphy was up a couple of points, and he ended up winning, I don’t know, I’d ask the media, but they won’t give me how many … What did he get? Do you know? Like 20, 21? He won by a lot. He won by a lot. I’d asked them, but we’re not going to get a straight answer."
Donald Trump,"They were not happy. They were not happy. I’ll tell you, Tuesday night, the fake news was not happy. They had their studios all built. CNN had their A- list talent. They don’t have A-list talent, but they had the best they could have. And they were all set. This was going to be the end of Trump, because this man was going to lose. But he turned out to be tough and smart. And in all fairness, I helped a lot too. And toward the end of the night, they started dismantling that studio. Probably it would have been there for four weeks. This is the end. But we had two great victories, congressional victories, on Tuesday night. And it was something. The one gentleman won by a number that nobody thought even possible, so much. And the other won a race that he was way, way, way back. In fact, I shouldn’t tell you this, but my geniuses, my people, some of those people standing right there, right there, some of them right there, they said, “Sir, don’t get involved in that race, sir. You can’t come back from 17 points, sir. It’s too much.” I said, “But you know, I really like the guy. I think he’s great. Let’s give it a shot.” They say, “Sir, if you lose, they will never, ever … It’ll be much worse.” I said, “Let me tell you, I know them very well. Whether I help him or don’t help him, it’s going to be the same. It’s going to be a disaster. So let’s help him.” And we campaigned, and we worked hard, right? They said, “Don’t do it, sir. Don’t do it. Please don’t do it, sir. It’ll be very embarrassing.” I said, “No, I don’t mind being embarrassed. I don’t mind being embarrassed.”"
Donald Trump,"We’re also very proud that unemployment among Native Americans has reached the lowest rate in nearly two decades. And we’re building an amazing future for citizens of every background, race, religion, color, and creed. And that’s what we have. That’s what we have. Race, religion, color, and creed."
Donald Trump,"But the radical left Democrats want to demolish everything that we’ve gained. They want to raise your taxes. They want to bury you in regulation. They want to take away your health insurance, 180 million Americans. They want to erase American history, crush religious liberty, indoctrinate our students with left-wing ideology. And left-wing Democrats want to confiscate your guns and eliminate your God-given right to self-defense. You know that. As your president, I will never allow them to take away your liberty, your dignity, and your social security. And I will never, ever allow them to take away your sacred right to keep and bear arms."
Donald Trump,"The left tries to threaten, bully, intimidate Americans into submission. They use Democrat prosecutors and phony congressional committees whenever they can. They’ll do whatever they can to demean you, to libel you. They try to blacklist, coerce, cancel, or destroy anyone who gets in their way. Look at what they’re doing today to Justice Kavanaugh. Look at what they’re doing. Did you see the New York Times? Did you see what they’re doing? Did you see what Democrats, they’re calling for his resignation. They’re calling for his impeachment. And the woman involved said she didn’t know anything. But they still, so the New York Times had to put out a major apology, and they had to change their story. The woman said, “I don’t remember that.” Can you believe? And they still want him to be impeached."
Donald Trump,"And I just put out a statement. And he’s a great man, by the way, a great talent. A great brilliant man, Brett Kavanaugh. and I just put out a statement on social media that said, I don’t think they’ll do it, but they should, for the good of the nation, “I call for the resignation of everybody at the New York Times involved in the Kavanaugh smear story.” And while you’re at it, the Russian witch-hunt hoax, which is just as phony a story."
Donald Trump,"They’ve taken, the old gray lady, do you know the New York Times, for years, the old gray lady, so prestigious, they’ve taken the old great lady and broken her down, destroyed her virtue, and ruined her reputation. She can never recover, and will never return to greatness under current management. The Times is dead. Long live The New York Times. Long lived The New York Times. And I do want it to live, but they have to be, they have to change their ways. Think of it, they wrote a story about somebody that said she doesn’t remember this. Can you even believe it? And yet, all of these radical left crazies are in judiciary committee and all of these committees that are set up to hurt the country."
