name,speech
Donald Trump,"watch this crazy Anderson Cooper. Third-rate. Lousy ratings. Third-rate person. But listen, CNN, the worst. I mean, the worst. The worst. Oh, the light just went off, see? Look. The light was on, they just turned. They don’t like it. It’s tough. You’re fake, CNN. No, it’s tough. I tried not to do that because I see their light on. When their light goes on, that means you’re live. No, that means you’re live. And every time, it’s tough. Look, in all fairness, they’re putting it on. It’s a broadcast. Very few people are  … Well, they might be watching us. I guess they do watch us."
Donald Trump,"Anderson . He used to interview me. He was so nice. Prior to running for politics, he was so nice to me. It was like they were love fests, but I don’t want anything to do with him. They were love fests. What a thought. He’s weak. He’s a weak person, but they’re all weak. But let me just tell you something. We need honesty with our media."
Donald Trump,"We need honesty, because the New York Times, the Washington Post … And by the way, I don’t know, you probably read it. We threw them out at the White House. We don’t show them anymore. If somebody wants to go and buy them; we threw them out. And they came into my office and then I got to get back to this guy. Where’s Hunter? Where’s Hunter? We had a tee shirt made, “Where’s Hunter? Where’s Hunter?”"
Donald Trump,"Poor Hunter. He then came out, he did the Morning Show. That was the last we’ve seen of Hunter. That wasn’t good. The morning of his father’s very bad debate, but it’s, where is Hunter? But before I say the final thing on Hunter and then we put him to rest for a while, we got rid of the Washington Post and the failing New York Times. We got rid of them, right? We don’t have them in the White House. I said, “No, you could … People can go out and buy them, but we don’t” …"
Donald Trump,"We used to have them stacked up, and I’d go in and I’d see a meeting with my people and they’re dealing with China, South Korea, or somebody. And I’d go into these offices; I’d see 10 or 15 of them packed up all over the place, the Washington Post, and the New York Times. I keep trying to figure out who’s worse. And one day it’s the Times, one day it’s the Post. It’s like top each other, they’re so bad. It’s so phony. In my opinion, it’s virtually corrupt. I’ve never seen it. You never have a good story. I mean, even when we got al-Baghdadi, the Washington Post had a story that he was like a great religious cleric. Where did that come from?"
Donald Trump,"The other thing, if Obama would have done it … because, look. This guy built ISIS. The caliphate, it was the size physically of Ohio, the state of Ohio, the great state of Ohio. That’s a big, lot of land. 7 million people, and they were the ones, the orange jumpsuits. I called a lot of the parents after we did this and I talked to them and they were … How can you be happy? But they were so thrilled that we got this animal. They were so thrilled. But you know what? And you know what? We don’t do it for … We do it because it’s right."
Donald Trump,"That story was a massive story. That was the biggest, maybe the biggest, one of the biggest, ever. Bigger than anything. That story disappeared so fast. Done. And that’s okay. I didn’t do it for the story. I did it because it’s the right thing to do. But if I were a Democrat, they’d be talking about that story for weeks. With me, they don’t even want to … They actually played it down. And actually, and I’m happy about this, Conan the dog got more publicity than me. And I’m very happy with that. I’m very … Conan is incredible. And Conan’s coming to the White House in a few weeks."
Donald Trump,"But it is true. Did you ever see a story disappear so fast? I mean, if Obama had that story, that thing would be going on for another seven months. They’d be talking about his bravery. Oh, so bravery. But again, 142 judges he gave us. Remember that. How can you be a great … They always say the most important thing a president can do is federal judges. We got two Supreme Courts. Great ones. Great judge. Gorsuch and Kavanaugh, great judges. By the way, did you ever see any human being treated worse than now-Justice Kavanaugh? Did anybody ever? Was any human being by these people, these horrible, horrible people that we have to deal with?"
Donald Trump,"Anyway, just to finish. So Hunter then goes to China. Now I’m dealing with China right now. They don’t like me too much. They dream about the day when somebody else … And would they like to have … How about this? You give this son, who has zero experience with investing, too, you give him $1.5 billion to invest, meaning he makes millions and millions of dollars, and the biggest guys on Wall Street can’t get it. He walks out with $1.5 billion. And then there are other places also, I understand. Folks, it’s disgraceful that the press doesn’t cover it for what it is. It’s a payoff. It’s a payoff."
Donald Trump,"And how would you like to have Sleepy Joe, with the son getting all of this money from China, become president and take over the China deal? They are not liking me. They had the worst year that they’ve had in 57 years. Their supply chain is broken up like scrambled eggs and they want to make a deal because those tariffs have given us millions of dollars and billions now, billions and billions of dollars. We’re taking billions and billions of dollars, and you know what we’re doing with some of it? Just a small portion, but 100%, they’re taking care of … Our farmers got $16 billion last year and $12 billion the year before because they targeted our farmers, because they know the farmers love Trump and Trump loves the farmers. So they targeted them and they brought the $16 billion down to practically nothing. And they thought our farmers would say, “Oh, we don’t like Trump.” They did just the opposite. They said, “We know he’s doing the right thing because we’ve been ripped off for so many years.”"
Donald Trump,"But I said to him, I said to Secretary of Agriculture, Sonny Purdue, a great guy; I said, “Sonny, how much did they spend buying our corn and soy beans and all of our agricultural product?”"
Donald Trump,"He said, “Sir, $16 billion.”"
Donald Trump,"I said, “Good, I’ll make it up.”"
Donald Trump,"And we’re going to have a lot leftover. So we will have, pretty soon, over $100 billion in money paid into the United States Treasury by a country that never gave us 10 cents. They only took. They only took. So when I said to the farmers, “We’re going to send you $16 billion, and it’s already been sent. And it’s been split into $12 billion the year before.” I mean, think of that, $28 billion. I said, “Compliments of China.”"
Donald Trump,"And we had a lot left over. Not bad, right? Not bad. You think Obama would do that? I don’t think so. You think Hillary would do that? I don’t think so. You think Sleepy Joe would do that? I don’t think so. He wouldn’t know what you’re talking about."
Donald Trump,"On Tuesday, the proud people of Mississippi will send Democrats a clear message. It’s very important for this reason, as well as the fact that you have a great gentleman in your midst. But you have to reject their extremism and their socialism and their corruption. They’re corrupt. Adam Schiff is a corrupt politician. You know when he made that phony speech where he made up a really horrible speech and said that I said it, I said, “Oh, I’m going to sue him.”"
Donald Trump,"They said, “Sir, I’m sorry. You can’t.”"
Donald Trump,"He’s got total immunity because he made it in Congress. Can you believe this? But here’s the good news. At least we have a forum, we have a place we can talk so everyone knows what’s going on. A bunch of phony people, but this is why we have to send a signal and why you have to make Tate Reeves your great, new Republican … Right? Republican governor, right?"
Donald Trump,"Hey, he’s a great guy, too. And all I know is he’s loved and respected by your current governor, because Phil is some piece of work. Phil is so confident. I wanted Phil to run for a certain office, then I wanted him to do something. I’ve tried to get him, but some guys are confident. Phil said, “No sir, I’ve been doing this all my life. I love the people.” He built the most beautiful African-American museum. Phil, he’s the greatest, but he built the most beautiful … But he’s got confidence. And he said, “No sir, I’d been doing it. I don’t really want to do that.” In other words, he said, “That’s enough.”"
Donald Trump,"Most people are so insecure, they keep going and going and going. It’s not good. I like Phil’s attitude better. But Phil is great, but I’m going to introduce Phil in a second. But Tate Reeves, who Phil endorses and views as a champion for your state and, really, a champion for Mississippi values. And Tate helped cut your taxes over 50 times, including the largest tax cut in Mississippi history. Tate is pro-worker, he’s pro-jobs, he’s pro-family, he’s pro-life. Tate is a true leader in the fight to protect the unborn. The other side is not. Tate Reeves will support our police, oppose sanctuary  … Oh, we love our police, right? I love our police. We love our police."
Donald Trump,"He’ll oppose sanctuary cities, which is just terrible. They’re terrible. And Tate will always defend your Second Amendment. So Tate’s running against a liberal Democrat named Jim Hood. Now all I know about Jim Hood is he fought very hard to elect crooked Hillary Clinton and Barack Hussein Obama. Isn’t that nice? He wanted Obama to win so badly and then he wanted Hillary to win. And that’s not the kind of guy we need here. Not in Mississippi. He’s supported by extreme leftists like Stacey Abrams, who, by the way went down to defeat in front of a terrific gentlemen from the great state of Georgia, Brian Kemp. And they came in with … Oh, they brought them all. They had President Obama, they had Michelle Obama, they had Oprah Winfrey. They came in, and all he had was Donald Trump, and we won. We won, fairly easily."
Donald Trump,"But Stacey Abrams wants to give illegal aliens the right to vote. Do you believe this? I mean, some of these people, they want to give them education. They want to give them this. They want to give them free healthcare. They want to give these people, that come into our country illegally-"
Crowd,Kick them out.
Donald Trump,"… more advantages than our own citizens have, more advantages than our own military has. Jim Hood wants to raise your taxes. He supports taxpayer funding for abortion providers. He supports illegal immigration  all benefits, and he opposed our travel ban, which is so important that we won in the United States Supreme Court to keep terrorists the hell out of our country."
Donald Trump,"And Jim Hood went to the United Nations and opposed your right to self-defense. If you don’t want a far left Democrat running Mississippi … Wait a minute. How’s this guy? I can’t believe this is a competitive race. It’s embarrassing. I’m talking to Mississippi. I’m talking to Mississippi. I can’t believe it. I don’t think that he’s going to be the right guy. I think the guy that you want is Tate Reeves. He’s going to be fantastic. He will be a great, great governor. Tate, come on up. Tate."
Crowd,"Tate, Tate, Tate, Tate."
Tate Reeves,"Thank you, Mr. President."
Donald Trump,.
Tate Reeves,"Thank you, Mr. President. Mississippi welcomes you, because Mississippi is Donald J. Trump country. We gave you almost 60% of the vote in 2016, and next year we’re going to do even better. And the reason is because President Trump is a strong leader. He is the right leader to defeat the radical liberals who have taken over the Democratic Party. Now these radical liberals have been trying to remove our president from office since the very day he was sworn in. They have disrespected him, and that means they have disrespected us. Jim Hood does not stand with our president. He stands with the radical liberals."
Crowd,.
Tate Reeves,"When the radical liberals tried to stop the president on border security, Jim Hood stood with the liberals."
Crowd,Build the wall.
Tate Reeves,"When the choice was Donald J. Trump or Crooked Hillary, Jim Hood stood with Hillary Clinton. And today, with the election just days away, I’m standing with President Donald Trump, and Jim Hood is standing with the liberals. Now, Mississippi, it is time to choose. It is time to stand up and be counted. Are we going to stand with President Donald Trump? Are you going to stand with me on Tuesday? Let’s stand up to keep America great. Let’s stand up to elect a conservative that will be an ally to President Donald J. Trump. I need your prayers. I need your support and, most importantly, on Tuesday, I need your vote. Thank y’all."
Crowd,.
Donald Trump,"Thank you, Tate. Tuesday, go out and vote for Tate. He’ll never let you down. And don’t kid yourself. Your Second Amendment is under attack, but not with him. It’s under attack. So we’re also joined tonight by a man who is truly, and I’ve sort of said it a lot, but he’s been a great governor and he loves your state. He loves the people of this great state, Governor Phil Bryant. Where’s Phil? Come up, Phil. Come up."
Donald Trump,"Oh, he’s central casting. Look at him. Come here, Phil."
Phil Bryant,"All right, I just want to say one more thing. Is this Trump country? This has been the greatest president of my lifetime. And let me tell you why. What we always wanted was a fighter. We said somebody should stand up to the Democrats and fight. Well, this is what fighting looks like. Let’s go make America great again."
Crowd,"U.S.A, U.S.A, U.S.A, U.S.A, U.S.A, U.S.A."
Donald Trump,"Thank you, Phil. Thank you. Thank you, my Phil. What a job. What a great job. You have to continue that whole thing going forward. So another man who’s a warrior is a friend of mine. Whenever there’s a problem, he’s there. He’s always there. He’ll be right at the front. He is tough. He is smart. He’s brilliant, actually. And he loves this state and he loves you people. Senator Roger Wicker. Roger."
Donald Trump,"Thanks, Roger. Thank you, Roger. And somebody, I’ll call her up because, believe it or not, she’s running with me. She just ran. I said, “Cindy, you just ran. You just won.”"
Donald Trump,"She said, “No, I have to do it again.”"
Donald Trump,"She’s running in 2020. I thought she’d have six years. I said, “Cindy, it’s only like a year.” Cindy Hyde-Smith. She’s incredible. She’s tough and smart and strong, and she’s with us all the way. Cindy Hyde-Smith."
Cindy H-S,"this Tuesday, Mississippi can send a message to the entire nation. We can let the liberal Democrats with their socialist agenda know it may be alive and well in the heart of Nancy Pelosi, but it is dead in Mississippi."
Cindy H-S,"We can let them know we don’t want open, illegal borders for drug smugglers to come through them. We can let them know that to kill an unborn baby is not a human right. It is a human life. This is a great crowd tonight. Next Tuesday, let’s go out and vote. Let’s support our governor, Tate Reeves. Let’s support these Mississippi Republican candidates. Go out and vote and let’s show the president how much we appreciate him, right now."
Donald Trump,"Trent Kelly, Michael Guest. Incredible people. And your next Lieutenant Governor, Delbert Hosemann. Your next Attorney General, Lynn Fitch. Your next Secretary of State, Michael Watson. Great people. Your next State Treasure, David McRae. State Auditor, Shad White. Agriculture Commissioner, Andy Gipson. Insurance Commissioner, Mike Chaney. And former governor, a man that nobody’s ever heard of in this room, I’m sure, but the truth is he’s a legend in politics and a great guy. He’s a great guy, Haley Barbour."
Donald Trump,"Thank you, Haley. Great guy. So with the help of everyone here, we’re the hottest economy in the world, we’ve created over 6.7 million new jobs since the election. If I would have said during the campaign that I would create 6.7 million new jobs since the election, these people would have gone crazy. They would have said horrible things. They would have said it’s impossible. Unemployment has reached the lowest rate in over 51 years, soon to be historic. African-American unemployment just dropped to the lowest rate ever recorded; historic. Really unimportant to me, the African-American youth unemployment rate is the lowest ever recorded in the history of our country. We lifted 55,000 Mississippi residents out of poverty, 55,000. Hourly earnings  …"
Donald Trump,"Hourly earnings are up 9% in Mississippi since the election. Under the previous two administrations, we lost 60,000 factories in our country. Under my administration, we’ve already added nearly 10,000 new factories, and many more are coming in as we speak. To get relief to working families, we passed massive tax cuts on average $2,000 to $2,500 per family, bringing almost $1 trillion back home to our shores. What’s happening? You couldn’t get the money. The big companies, they couldn’t get their money back both bureaucratically and from a tax standpoint. They brought back almost $1 trillion now because of us. All put to work."
Donald Trump,"We slashed the largest number in history of job-killing regulations, and we ended the war on American energy. We are now the number one producer of energy by far anywhere in the world."
Donald Trump,"For decades, you saw corrupt politicians take money from lobbyists to impose catastrophic trade deals. Mississippi lost 40% of all manufacturing jobs after the twin disasters of NAFTA and China’s entrance into the World Trade Organization. Two of the worst deals ever made by our country. 100,000 Mississippi jobs were wiped away just like that, and that’s awful, and a big price to pay for Washington’s disloyalty to the American worker. That’s what it was. It was disloyalty, stupidity, corruption, lots of reasons. But now you finally have a President who is loyal to you, and I am."
Donald Trump,"I’m a fighter for your jobs, for your wages, your factories, your families, and your dignity. We’re stopping China from ripping us off. We’re stopping all of these other countries from taking advantage of the United States where we lose our money, we lose our wealth, we lose our jobs, we close our factories. That’s not happening anymore. It’s reversed. We were the sucker country for years and years, but we are not the sucker country anymore, and they all know it."
Donald Trump,"We’re replacing NAFTA … and that was a disaster, NAFTA … with the brand new US, Mexico, Canada agreement if Nancy Pelosi will ever put it up to a vote, which is questionable. Nervous Nancy, she doesn’t want to give the people of our country a victory. She’s very busy doing other things. Having fun. The USMCA will be a massive victory for Mississippi’s farmers and also includes powerful protections for Mississippi auto workers, manufacturers, and everybody else. It’s a great agreement. About time we got rid of NAFTA. The do-nothing Democrats need to stop their madness and pass the USMCA right now."
Donald Trump,"The last administration’s horrendous Trans-Pacific Partnership would have destroyed the US auto industry, but I proudly, first thing, withdrew from that job-killing calamity. Under our policies, Toyota has just announced a $170 million investment in Mississippi and 400 new jobs at its facility … did you ever hear of this place … Blue Springs. Blue Springs."
Donald Trump,"Before my election, our leaders used the great American middle class as a piggy bank to fund their delusional global projects all over the world. We take care of other people. We take care of other countries, but we don’t take care of our own. They knowingly decimated American manufacturing to promote economic growth in foreign countries. They deployed our military to protect … think of this … immensely wealthy nations, subsidizing their welfare states with your money. I ask those wealthy nations now, I respectfully the other day said to the King of Saudi Arabia, “King, we’re going to help you, but you’ve got to pay.”"
Donald Trump,"And he was great. No, he was great. He was great. He said, “But nobody has ever asked before.” I said, “But I’m asking.” And billions of dollars will come in, and we’re protecting a great ally. We have a country that spends billions and billions of dollars in our country buying military and other things. But we said, “You’re very wealthy. You have to pay,” and they’re going to pay. And that’s true with many countries by the way. That’s true with many countries. They never respected us. They could never believe it. I said to one country … I have great respect for the Prime Minister of Japan. I said to Prime Minister, I said, “How did you get away with this for so long?” And he looked at me and he couldn’t really answer it because how the hell did this happen? We’re protecting 94 countries. Ask China, “How many countries are you protecting President Xi?” And they look at me like, “What a stupid question. We protect one. China.” You ask President Putin, “How many countries are you protecting President Putin?” And he looks and he goes, “Russia.” You ask other countries … we’re protecting at least 94. In fact, so many they can’t even tell me. I’ve been trying to get an answer for four months. So many they can’t even tell. It’s crazy, but it’s all beautiful the way it’s happening. A lot of good things are happening."
Donald Trump,"But these same politicians poured precious American blood and treasure into the sands of the Middle East while allowing our cities to fall into disrepair and decay. Our failed ruling class believed it was their right to rule over you, to take your money, to take your jobs, to redistribute your wealth all over the globe, wherever they wanted it. But I don’t like that. I don’t like that. The great sellout has ended, and it ended the day I took the oath of office. That was quite a day."
Donald Trump,"After years of building up foreign nations, we are finally building up our nation. We are finally putting America first. Our policy of never-ending war, regime change and nation-building is being replaced by the clear-eyed pursuit of American interests."
Speaker 3,There you go.
Donald Trump,"It is the job of our military to protect our security, not to be the policemen of the world. Proving the wisdom of this approach, we recently secured a permanent ceasefire in Northern Syria without spilling one drop of American blood. Not one drop. Actually, I have to be honest. One soldier stepped on a nail. That’s true. I said, “Don’t tell the press that because they’ll say, but one soldier stepped in a nail.” I said, “How bad was it?” “It’s okay.” I said, “Don’t mention it please.” They always like to mention exactly what happened. You can take it a little bit low key. Stepped on a nail."
Speaker 3,Go Donald.
Donald Trump,"Not a drop of blood. And we don’t have to defend the borders between Turkey and Syria. They’ve been fighting for 1000 years. But what we do is we did keep the oil, if you don’t mind. We kept the oil. We kept the oil. And we’ll distribute that oil, we’ll help out the Kurds, and we’ll help out other people. We’ll also help out ourselves if that’s okay."
Donald Trump,"Past leaders, foolish military adventures turned far away nations into very, very dangerous war zones. Then they demanded that American citizens accept unlimited migration from those terror-afflicted nations and regions. I don’t think so. I don’t think so. We did not fight them over there only to invite them over here. We don’t want to do that."
Donald Trump,"To protect our communities, my administration restricted migration from terror-prone nations and implemented the toughest ever vetting procedures. Toughest ever that we’ve ever had. No issue has ever been so horribly discarded by a party as that issue by the Democrats. They want open borders, which mean crime. They want sanctuary cities, which means crime and drugs and death. After bleeding the middle class dry, Democrats threw open our borders to the world, flooding our communities with poisonous drugs and criminal cartels. Republicans believe in strong borders and safe communities. We are now building a wall."
Speaker 4,Build that wall. Build that wall. Build that wall.
Donald Trump,We’re building it.
Speaker 4,Build that wall. Build that wall. Build that wall. Build that wall. Build that wall.
Donald Trump,"We’re building it. And you think that was easy? The Democrats, they didn’t want that wall. I got money for everything, but when it came to the wall, not 10 cents. Not 10 cents. But we gave the military a lot of money and we took it from the military and we took it from here, we took it from there. Or we had to go to court and all of a sudden we start winning cases. We’re winning cases now. Winning a lot of cases."
