name,speech
Audience,"USA, USA, USA, USA, USA, USA, USA, USA, USA."
Donald Trump,"Thank you very much. Thank you. Thank you. Thank you to Greenville, North Carolina, I want to thank you. And to, Mike Pence, you’ve done a great job. Great Vice President. Thank you Mike. And we have all night, we’re going to have a lot of fun tonight, and I have nothing to do, nothing, nothing. We have nothing to do but make our country great again, and that’s happening fast. It’s wonderful to be back in this beautiful state with thousands of hardworking North Carolina patriots, and thank you for your support."
Donald Trump,"Thank you for that very big victory we had three years ago. Time is flying. You getting ready? Let’s do it again. Right? Let’s do it again. I just heard that the United States House of Representative, has overwhelmingly voted to kill the most ridiculous project I’ve ever been involved in, the resolution. How stupid is that? Own impeachment. I want to thank those Democrats because many of them voted for us. The vote was a totally lopsided 332 to 95 to 1."
Donald Trump,"332 to 95, think of it, we have the strongest economy in history, the lowest unemployment numbers ever, we’ve rebuilt the most powerful military, it was totally depleted when I took office, and now it’s rebuilt. We passed the largest tax cuts and regulation cuts of any president or any administration in history. We took care of our great vets, including veterans choice, and veterans accountability. And they want to try and impeach, it’s a disgrace. It’s a disgrace."
Donald Trump,"So now we have that behind us, and I have to say this, and I’ll say it just once, what happened to me with this witch hunt should never be allowed to happen to another president of the United States. Never, ever again. I want to thank Republican leadership for what they’ve done for all of us, by stopping that hoax, the Russian hoax I call it, because America is winning again. America’s respected again, and, because we are finally putting America first."
Donald Trump,"Our economic policy can be summed up in three very beautiful and simple words, jobs, jobs, jobs. We’ve created 6 million new jobs since election day. If I would have said that, nobody would have believed it. If I would’ve said that, the fake news would have said he’s exaggerating. And I wouldn’t have said it because I wasn’t even sure we could do it. Think of it, 6 million jobs since election day, think of it. And by the way, North Carolina has had its best economic year in the history of your state."
Donald Trump,"Our country has added more than 180,000 people to the workforce, and think of that through what we’ve done on a federal basis. You picked up over 180,000 jobs, North Carolina. Think of that, and you have your lowest unemployment rate. You have a lot of good things, but let’s not talk too much about North Carolina. Let’s win this election nationwide. You remember North Carolina, that was going to be the Clinton firewall. She spent a fortune here, and I kept coming in and coming out. They call it, earned media. I earned it."
Donald Trump,"I kept coming in and coming out, and every time I left they said, “I don’t think we’ll lose in North Carolina.” You know what? I was right. We won it. We won it easily. We won it easily. So I just want to thank everybody. Seriously. This is a big… that was a big deal. November 8th, that was a big deal. Donald Trump has won the great state of North Carolina. A big deal. That was when you started to see the folks at a certain other convention, beautiful looking place."
Donald Trump,"One of the most beautiful venues I’ve ever seen, but I don’t want any part of it. It was unlucky. I don’t want any part, but that’s when you saw the people say, what the hell is going on? What? What’s happening? And then it was state after state, it was Florida, it was South Carolina, we love South Carolina. Right? Unbelievable. It was Pennsylvania. Remember they wouldn’t announce the numbers in Pennsylvania, so there was 1% of the vote remaining."
Donald Trump,"If I lost every one of those votes, we still win by a lot, and they wouldn’t announce it. They wouldn’t announce it. And then we won the great state of Wisconsin. First time in many, many decades, that a Republican won. And then we had a surprise, but not a surprise to us, because we’re bringing back the auto industry. We brought so much back to the great state of Michigan. That was a shocker, remember that?"
Donald Trump,"Do you remember a certain hand on that beautiful board and they said, “You know this sport is getting awfully red.” That’s Republican. “There’s a lot of red up there.” We had a lot of… That was one hell of a night, wasn’t it though? One hell of a night. I think it was maybe, you know there are those that say, one of the most extraordinary and exciting evenings in the history of television and the history of anything. And you know, you can go, all over the world in some cases, it was morning."
Donald Trump,"You go to Asia, you go to Europe, you go all over. It was just record setting and here’s the point, we have to do it again. We have to do it again."
Audience,Four more years! Four more years! Four more years! Four more years! Four more years! Four more years! Four more years! Four more years!
Donald Trump,"And the reason we have to not only to do new things, which we will, and you know statutorily and we had all sorts of artificial witch hunts over our head. Can you imagine if we didn’t have to go through that hoax? I don’t know that we would’ve done any better to be honest with you. I think we’ve done more in two and a half years than any president ever< first two and a half years. But could you imagine what it could have been if we didn’t have the witch hunt?"
Speaker 4,Bullshit.
Donald Trump,"You said it. He said it. I won’t say it because it’s a Harrell, it’s a terrible word. So I will not say that this guy said, if we didn’t have the bullshit, that’s all. No, no. Could you imagine if we didn’t have the time wasted the time and everything. Can you imagine? And you know a friend of mine said maybe you wouldn’t have done as well. Is that possible? That can happen."
Speaker 4,No. No.
Donald Trump,"Maybe we would have had too much time on our hands. Who knows? But I can say, nobody in their first two and a half years has done anywhere close to what we not being what we, not me, what we’ve all done. It’s true. The unemployment rate among African Americans is the lowest in the history of our country. Unemployment among Hispanic Americans, where we’re doing really well, you know why? Because they want a strong border. They want it because they understand the border better than anybody."
Donald Trump,"They want that strong border. They want that wall that’s being built right now. They want that wall, and they really do. They understand the border better than anybody, and they don’t want criminals coming in. They don’t want crime coming, they don’t want to lose their jobs. They like the fact that their salaries are going up, their wages are going up, they understand it better. So Hispanic American, the best unemployment numbers in our history, Asian Americans, the best unemployment numbers in our history."
Donald Trump,"And likewise women, 74 years. So I’m sorry women, I let you down. It’s not in our history, but we’re going to be there very soon. We’re going to be there very soon. Women are doing incredibly and women… the men are going to get angry. Sorry men. Whoa, look at all those signs. Women for Trump. Wow, thank you. That’s a lot of signs. You remember last election, Donald Trump will never ever get the women. Then we got this tremendous number of women."
Donald Trump,"We got this tremendous number of women, and during the election night, they say, “What’s going on?” you know it’s called suppression polls. Suppression. Polls are just as fake as the news itself, but women filled 60%, and I’m sorry to tell you this, men, they’re going to sue me for discrimination now. Women fill 60% of all of the new jobs created last year. Women took 60%, what’s wrong with you, men? What’s wrong with you? But the radical Democrats are trying to destroy all of our country’s tremendous achievement, and our country’s tremendous success. Unprecedented."
Donald Trump,"We’ve had unprecedented success. Leaders come in from other countries, prime ministers, presidents, kings, queens, dictators. Sometimes, I hate to say it, dictators, and they all start off by saying, “Mr. President, I’d like to congratulate you on the incredible economy that you’ve created. The greatest anywhere in the world by far.” And sadly, China who I have a very good relationship with President Xi, I really like him. But China has had… yesterday it was announced, the worst year in 27 years."
Donald Trump,"We’ve had the best, and if our opponent ever got into office, instead of being up, 62% instead of those 401ks of yours being up 60, 70, 80, 90%, crash, big crash. You would have had a crash, the likes of which we have never seen before, if they got in office. Because we freed up our country, we freed up our economy especially with regulation cuts, but also with those big beautiful tax cuts. We freed it up."
Donald Trump,"The leading voices of the Democrat Party are left wing extremists, who reject everything our nation stands for. But again, I have to tell you, this vote was so big. I have to thank many of the Democrats. I mean, that was amazing. No, no, I really do. I respect it. I really do. That was a slaughter, but many of those people that voted for us this afternoon in somewhat of a sneak attack, a real sneak attack, many of those people that voted for us were Democrats, and I want to thank them, because they did the right thing for our country."
Donald Trump,"Republicans know that America is the greatest force for peace and justice in the history of our world. But these left-wing ideologues see our nation as a force of evil. The way they speak, so badly of our country. They want to demolish our constitution, weaken our military, eliminate the values that built this magnificent country. You have to look at some of their recent comments which are never talked about. When you see the four Congress women."
Donald Trump,"Oh, isn’t that lovely? I’ll give you just a couple, I’ve had pages and pages, but we don’t want to bore you. We don’t want to go too long. But we have to give a couple, because that’s the great thing about live television. They can’t cut it. Representative Ilhan Omar, of a really great state, I almost won the first time in decades and decades, Minnesota. Greg Stanton."
Audience,"USA, USA, USA, USA, USA, USA, USA, USA, USA, USA."
Donald Trump,"By the way, I keep hearing how much enthusiasm is in the radical left. I don’t think they have enthusiasm. They’re just fighting with each other. We have all of the enthusiasm. He goes home now to mommy, and he gets reprimanded, and that’s the end. Sorry mommy. Sorry mom. Didn’t mean to embarrass your mom. But it’s true, we have the enthusiasm folks. Look at this. Look at this. And by the way, thousands and thousands of people outside and people that couldn’t get in, thousand. We’ve got all the enthusiasm. They’re fighting each other. They’ve gone so far left, nobody wants to even think about it."
Donald Trump,"So representative Omar, blames the United States, for the terrorist attacks on our country, saying that terrorism is a reaction to our involvement in other people’s affairs. She smeared US Service members involved in Black Hawk Down. In other words, she slandered the brave Americans who were trying to keep peace in Somalia. Omar minimized the September 11th attacks on our homeland, saying some people did something. I don’t think so. Some people did something. Yeah, some people did something. All right. She pleaded for compassion for Isis recruits attempting to join the terrorist organization."
Donald Trump,"She was looking for compassion. Omar laughed that Americans speak of Al-Qaeda in a menacing tone and remark that, you don’t say America with this intensity. You say, Al-Qaeda makes you proud. Al-Qaeda makes you proud. You don’t speak that way about America. And at a press conference just this week when asked whether she supported Al-Qaeda, that’s our enemy. That’s our enemy. They are a very serious problem that we take care of, but they always seem to come along somewhere. She refused to answer. She didn’t want to give an answer to that question. Omar blamed the United States for the crisis in Venezuela."
Donald Trump,"I mean think of that one, and she looks down with contempt on the hardworking American, saying that ignorance is pervasive in many parts of this country. And obviously and importantly, Omar has a history of launching vicious antisemitic screens."
Audience,Send her back! Send her back! Send her back! Send her back! Send her back! Send her back! Send her back! Send her back! Send her back! Send her back! Send her back! Send her back!
Donald Trump,"When she talked about the evil Israel, and it’s all about the benjamins. Not a good thing to say. So that’s Omar. That’s Omar. And by the way, many other things, all you have to do is press the right button on your beautiful screen, and you’ll see thing after… You didn’t hear this over the last two days or did you hear anybody talk about this? Her colleague Representative Rashida Tlaib, agreed with Omar’s characterization of 9/11 and said that members of Congress who support Israel forgot, what country they represent."
Donald Trump,"And Tlaib also used the F word to describe the presidency and your president. That’s not nice, even for me. She was describing the President of the United States and the presidency with the big fat vicious, the way she said it, vicious F-word. That’s not somebody that loves our country. Representative Alexandria Ocasio-Cortez. Check out her scores by the way, with her green new deal, the green new deal. Where did that come from? She’s conducted outrageous attacks against men and women of law enforcement, she compared American border agents managing a humanitarian crisis, that I always said was a humanitarian crisis, and they said it was manufactured."
Donald Trump,"They don’t say it was manufactured, and we’re stopping it and I want to thank Mexico. They’ve got 21,000 soldiers now stopping people from coming into our country. But Cortez, somebody said that’s not her name it’s… They said that’s not her name, sir. I said, “No, no, I don’t have time to go with three different names.” We’ll call her Cortez. Too much time. Takes too much time. So Cortez also, she said essentially Nazis are running concentration camps, and when Mike Pence went down just a few days ago with members of Congress and the media, and you looked at those so-called horrible concentration camps, they said, “Wow, these places a clean. Wow. They have air conditioning, they have water.”"
Donald Trump,"And you know, to be honest, it’s not like they came and we want to take care of people. We got to straighten out our immigration laws. You know, in a very short period of time, if the Democrats would give us a few votes, we could solve the immigration problem and it would be so great. It would be so great. But these kids and these people come from rough places. And I’ll tell you what, some of them said, “We’ve never lived like this before.” They have water, they have air conditioning, they have things that they’ve never seen."
Donald Trump,"And we listen to her talking about drinking water from toilets, which was a lie, which was a lie. Cortez said that illegal immigrants are more American than any person who seeks to keep them out ever will be, can you believe that? That’s what she say. She described contemporary America, that’s you, that’s me, that’s all of us, as garbage, garbage, a garbage. Remember deplorables, right? That sounds worse."
Donald Trump,"I think that’s worse, but we’ll save it for whoever’s going to be the nominee, and right now, sleepy Joe’s not looking too good, Pocahontas. Pocahontas is gaining a little bit, because we probably use the Pocahontas a little bit too early, but that’s okay. We’ll bring it out of retirement very soon. They have a new one who knocked the hell out of Biden during the debate? He said, “I wasn’t prepared for that question.” That’s not a good answer. Can you imagine? And according to the polls, I won every single debate Republican and against Hillary. Can you imagine?"
Donald Trump,"Those are the polls. They won’t admit that. Many, many polls. But can you imagine if I said, “Uh-oh, I’m sorry I wasn’t prepared for that question.” I’m gone. That’s the end of Trump. He’s not prepared. He’s not mentally prepared, that’s his problem. But everybody that knows him knows that. But no Harris hit him with the pretty easy question on busing. What I would say that’s pretty easy, and he choked. He choked. And then he said, “Ah, yeah, I’m sorry I ran out of time. I ran out of time” He ran out of time."
Donald Trump,"And then you have a young guy, Buttigieg, Buttigieg. They’re saying how to say his name, Buut-ih-jij. He’s a beauty. He runs a failed city. His city is doing so badly. Mike Pence was the governor of that state. I said, “How was he as the mayor?” Mike is one of the nicest human beings you’ll ever meet. And Mike said, he never did a good job, I’m so shocked to see him running. Okay. And then he goes back home, and African Americans literally were so angry at him for the lousy job and he’s supposed to be like a hot young star, if that’s a hot young star, I guess I just don’t no star anymore. That is not as star."
Donald Trump,"That’s not a star. Buut-ih-jij, you say, Buut, and then add ih-jij, Buttigieg. I don’t see him dealing with President Xi of China. I don’t see him meeting successfully with Kim Jong-un. I don’t see him dealing, and nobody has been tougher with Russia than Donald Trump. I don’t know see him dealing with Vladimir Putin. And we have good relationships with them and many others, except now we’re no longer the suckers. Like with NATO, we protect Europe. We spent hundreds of billions of dollars and they’re not paying their fair share."
Donald Trump,"So last year I went and said, “Folks, sorry, you got to pay your fair share.” 16 years was going like this? The contribution, and now it’s like a rocket ship, $100 billion. I said to him, great people, 28 nations, including the US, I said to him, “Listen, we’re taking care of you. You screw us on trade, and you don’t pay your military bills. This is not a good deal for the United States.” So we’re taking care of trade. We want to do it nice and slow and easy. You know, we got a world balance, but European Union is terrible to us on trade, terrible."
Donald Trump,"Frankly, they’re as tough or tougher than China, just smaller in numbers. That’s the only difference. With China, 507 billion dollars, a you look over the years, for many, many years, they’ve been taken. And guys like Biden say, “Uh-oh, We’d them them.” And he was there eight years, “We’d stop that.” No, Trump is stopping it. Trump is stopping it. Representative Ayanna Pressle. Is she related in any way to Elvis? I don’t know. Who knows? You never know. She thinks that people with the same skin color, all need to think the same."
Donald Trump,"She said, “We don’t need any more brown faces that don’t want to be brown voices. We don’t need black faces, that don’t want to be a black voice.” And here we are. But since we’ve  disrespectful to people that have taken a lot of shots to the face, but they wouldn’t attack some of these people in this room. They’re not attacking bikers for Trump. They’re not  or military. You know they’re attacking a single man standing there with a camera, who never got hit and never hit back before in his life."
Donald Trump,"They’ll attack the people, they attacked. Picture that wouldn’t look too good for the people, these are sick bad people remember that. These are bad people. These are bad people. They don’t get the bad press, the press doesn’t want to talk to them. They are very evil. They’re hitting people over the head with sticks, and I mean sticks. I mean bats even. They’re whacking people with bats. They’re very brave. They always show up with a mask and they’re covered. Because then they go home to mom and dad. They don’t want mom and dad to know where they were, but they always attack people that really can’t defend  that."
Donald Trump,"They’re very brave. They always show up with a mask and they’re covered. Because then they go home to mom and dad. They don’t want mom and dad to know where they were. But they always attract people that really can’t defend themselves very well. Right? They’re attacking this group. They’re not attack North Carolina. That’s for sure. So these Congresswomen, their comments are helping to fuel the rise of a dangerous militant hard left, but that’s so, they are very evil. They’re hitting people over the head with sticks, and I mean sticks. I mean bats even, they’re whacking people with bats. They’re very brave."
Donald Trump,"They always show up with a mask and they’re covered, because then they go home to mom and dad. They don’t want mom and dad to know where they were. But they always attract people that really can’t defend themselves very well. Right? They’re attacking this group. They’re not attack North Carolina. That’s for sure. So these Congresswomen, their comments are helping to fuel the rise of a dangerous militant hard left, but that’s okay, because we’re going to win this election like nobody’s ever seen before."
Donald Trump,"And tonight I have a suggestion for the hate filled extremists, who are constantly trying to tear our country down. They never have anything good to say. That’s why I say, “Hey, if they don’t like it, let them leave. Let them leave. Let them leave. Let them leave.” They’re always telling us how to run it, how to do this, how to the… you know what? if they don’t love it, tell them to leave it. I don’t know. And I’ll watch, I’ll go back to the, “Oh sir, that was so controversial, sir.” No, I’m just saying it’s their choice. They can come back when they want, but you know, they don’t love our country, I think in some cases they hate our country."
Donald Trump,"And it’s so angry, even yesterday they went on the stage. I said, “Let me watch this.” And the anger, they were trying to be nice, but it’s hard. It’s hard for them to do that. That choice for every American has never been more clear. That’s true. The Democrat agenda is anti worker, anti jobs, anti citizen anti-family and anti common sense. With the exception of all of those Democrats that voted for us today, we’ll give them up, okay? They’re fine, they’re fine. They are fine and you’ll lose to them, it’s different. It’s okay. It’s called normal political back and forth."
Donald Trump,"But I want to tell you something, the Democrats are being violent, so vicious, moving so far left, it’s out of control. It’s out of control. The Republican agenda is pro-worker, pro-jobs, pro-family, pro-growth, and 100% pro-American."
Audience,"USA, USA, USA, USA, USA, USA, USA, USA, USA."
Donald Trump,"So we’re thrilled tonight to be joined by several North Carolina Republican leaders. Really great people. They’ve been so helpful to me and they’re doing an incredible job. Lieutenant Governor, Dan Forest, Lieutenant Governor. North Carolina, Treasurer Dale Folwell. Greenville Mayor, PJ Connelly, I hear he does a good job, PJ. And North Carolina GOP Chair, Michael Whatley."
Donald Trump,"I want to also  three months when we needed him most, Senator Tom. Thank you Tom, you really have. You’ve been really good and we got to get out and work and make sure he gets reelected. And also, senators Mark Walker and . And two friends of mine that decide hoax of impeachment, where they could bask in the glory of victory. I said, “Stay back.”  is here right now.  incredible NCAA wrestling champion, great guy. He wanted to stay back."
Donald Trump,"I said, “You sure you don’t want to come?” “I do want to come, but I really want you to win today, if you don’t mind.” I said, “Okay, you better stay back. If I see you here I’m going to be very angry.” And they did their job, didn’t they? This man is from the great state of Ohio, Congressman Jim Jordan. We’re going to do this quickly, but it’s just important that you get out and vote, they’re two great people. I want to introduce the next member of Congress from North Carolina’s third congressional district, just won a great race, Dr. Greg Murphy. Greg is a winner."
Dr. Greg Murphy,"Thank you President Trump for coming back to Eastern, North Carolina. This is Trump country. I promise if elected your congressman, I will be a congressman that has our president’s back. The third district is not going to elect another Pelosi congressman, it is not going to do that. We thank him for coming eastern North Carolina and we are here to support him. Thank you all."
